title,description,url,image_url,published_date,source,author,content,category,data_source,critique/originality-value-purpose,news_meets_standards/originality-value-purpose,critique/relevance-audiance-impact,news_meets_standards/relevance-audiance-impact,critique/up-to-date,news_meets_standards/up-to-date,critique/clarity-engagement-structure,news_meets_standards/clarity-engagement-structure,critique/quality-professionalism-transparency,news_meets_standards/quality-professionalism-transparency,critique/trust-accuracy-expertise,news_meets_standards/trust-accuracy-expertise,score/originality-value-purpose,score/relevance-audiance-impact,score/up-to-date,score/clarity-engagement-structure,score/quality-professionalism-transparency,score/trust-accuracy-expertise
Das nächste Ampel-Projekt für Deutschland in Gefahr: Europas Hoffnungsträger ist insolvent,"<div><img src=""https://www.merkur.de/assets/images/36/277/36277472-northvolt-chef-peter-carlsson-tritt-zurueck-2Bfe.jpg"" style=""width: 100%;"" /><div>Der Hersteller von Batterien aus Schweden, Northvolt, plant in Deutschland den Bau einer riesigen Fabrik. Jetzt ist das Unternehmen jedoch zahlungsunfähig. Welche Auswirkungen hat das auf das Bauprojekt?</div></div>",https://www.merkur.de/wirtschaft/das-naechste-ampel-projekt-fuer-deutschland-in-gefahr-europas-hoffnungstraeger-ist-insolvent-zr-93426508.html,,2024-11-23 09:11:00,Von:,,"Das nächste Ampel-Projekt für Deutschland in Gefahr: Europas Hoffnungsträger ist insolvent Von: Amy Walker Drucken Teilen Der Hersteller von Batterien aus Schweden, Northvolt, plant in Deutschland den Bau einer riesigen Fabrik. Jetzt ist das Unternehmen jedoch zahlungsunfähig. Welche Auswirkungen hat das auf das Bauprojekt? Update vom 22. November, 11:30 Uhr: Nach dem Antrag des finanziell angeschlagenen schwedischen Batterieherstellers Northvolt auf Gläubigerschutz in den USA ist Firmenchef Peter Carlsson zurückgetreten. Er bleibe dem Unternehmen aber als Mitglied des Aufsichtsrates sowie als führender Berater erhalten, teilte Northvolt in Stockholm mit. Carlsson führte Northvolt seit der Firmengründung im Jahr 2016 und zählt zu den Mitgründern des Unternehmens. Peter Carlsson hat seinen Rücktritt als Northvolt-Chef angekündigt. (Archivbild) © Marcus Brandt/dpa Erstmeldung vom 22. November, 8:30 Uhr: Stockholm/Heide – Die Krise in der Automobilindustrie hat Folgen für die ganze Lieferkette. Für Elektroautos bedeutet das unweigerlich die Batterien, bei denen Europa ohnehin schwächer dasteht als die Konkurrenz aus China. Das schwedische Unternehmen Northvolt sollte das ändern und zu Europas wichtigstem Batterieproduzenten wachsen. Dieses Vorhaben erhält nun einen Rückschlag: Die Firma ist insolvent. Northvolt meldet Insolvenz an: Batteriehersteller hat Milliarden-Schulden Der angeschlagene schwedische Batteriehersteller Northvolt hat Gläubigerschutz nach US-Recht beantragt und sucht nun nach einem weiteren Investor. Das teilte das Unternehmen am Donnerstag (21. November) mit. Das Sanierungsverfahren nach Kapitel 11 (Chapter 11) des US-Insolvenzrechts schützt Northvolt für eine gewisse Zeit vor dem Zugriff seiner Gläubiger und erleichtert damit den finanziellen Neustart. „Das über allem stehende Ziel ist es, mit einem oder mehreren langfristigen strategischen oder Finanzinvestoren zusammenzuarbeiten“, hieß es in den Gerichtsunterlagen. Zugleich erhält das Unternehmen Zugriff auf 245 Millionen Dollar und kann damit sein Überleben in den kommenden Wochen gewährleisten. Der Schritt, in den USA Gläubigerschutz zu suchen, kommt nicht überraschend: Die Nachrichtenagentur Reuters hatte vergangenen Freitag unter Berufung auf Insider gemeldet, dass Northvolt den Schritt in Betracht ziehe. Northvolt verfügt den Gerichtsunterlagen zufolge derzeit nur noch über flüssige Mittel von 30 Millionen Dollar – das reicht den Angaben nach gerade noch für eine Woche. Zugleich liegt der Schuldenberg inzwischen bei 5,8 Milliarden Dollar. Das Unternehmen hatte in den vergangenen Monaten mit seinen Geldgebern über ein Finanzierungspaket verhandelt, allerdings ohne Erfolg. Insolvenz von schwedischem Batteriehersteller: Volkswagen ist größter Anteilseigner Nun stellt der schwedische Lkw-Hersteller Scania Northvolt ein Darlehen in Höhe von 100 Millionen Dollar zur Verfügung. Damit solle die Herstellung von Batteriezellen für E-Fahrzeuge im nordschwedischen Skelleftea unterstützt werden. Scania bezieht schon jetzt Batterien von Northvolt. Die weiteren 145 Millionen Dollar sind Mittel von Northvolt, die bislang als Sicherheiten zurückgelegt wurden. Der größte Anteilseigner ist Volkswagen, auch die US-Investmentbank Goldman Sachs und BMW gehören zu den Eigentümern. BMW und Goldman Sachs lehnten eine Stellungnahme ab. Volkswagen erklärte am Abend, man stehe mit Northvolt in engem Kontakt. Die vom Northvolt-Mitbegründer Harald Mix geleitete Investmentgruppe Vargas beschrieb den Schritt als notwendig, um die Kapitalstruktur zu stärken. Gleichzeitig könne das Unternehmen den Betrieb aufrechterhalten, sich auf die Steigerung der Fertigungszahlen konzentrieren und die Kosten senken. Man sei überzeugt, dass Northvolt diese Zeit durchstehen werde. Northvolt selbst erklärte, das Unternehmen erwarte, die Restrukturierung bis zum ersten Quartal 2025 abzuschließen. Solange werde der Betrieb wie gehabt weitergehen. BMW zog Mega-Deal mit Northvolt zurück – Northvolt-Insolvenz ist Rückschlag für die Branche Der Batteriehersteller benötigt derzeit dringend Geld und arbeitet seit mehreren Wochen mit seinen Investoren an einem Rettungspaket. Die schwedische Regierung hatte jüngst erklärt, keine Anteile von Northvolt übernehmen zu wollen. Northvolt hat noch nie einen Gewinn erwirtschaftet und kämpft mit Qualitätsproblemen und Verzögerungen. Im Juni zog deswegen BMW einen Auftrag mit einem Volumen von zwei Milliarden Euro zurück. Wegen wegbrechender Aufträge und Problemen beim Hochfahren der Produktion hatte der Konzern zuletzt seine Ausbaupläne massiv eingedampft, tausende Mitarbeiter entlassen und Tochtergesellschaften verkauft. Noch am Mittwoch ernannte Northvolt den Sanierungsexperten Paul O‘Donnell zum Chef seiner Hauptanlage in Nordschweden. Der Antrag auf Gläubigerschutz ist ein Rückschlag für die europäischen Bemühungen, sich mit einer eigenen Batterie-Industrie unabhängiger von chinesischen Herstellern wie CATL und BYD zu machen. Nach Daten der Internationalen Energieagentur ist 85 Prozent der Batteriezellen-Herstellung in der Volksrepublik beheimatet. Northvolt hat zwar eine Reihe von europäischen Startups bei der Investition von Milliardensummen in die Batteriefertigung angeführt. Allerdings ist die Nachfrage nicht so schnell angestiegen wie von Teilen der Branche vorhergesagt. Northvolt baut Fabrik in Deutschland: Bau wird sich wohl verzögern Noch ist nicht abzusehen, was das konkret für den Bau einer Northvolt-Gigafabrik im schleswig-holsteinischen Heide bedeutet. Das Unternehmen erklärte dazu am Abend: Die deutsche Tochter werde unabhängig von der Muttergesellschaft finanziert. „Sie ist nicht Teil des Chapter 11-Verfahrens.“ Deutschlandchef Christofer Haux sagte, „in Dithmarschen schreiten die Bauarbeiten derweil weiter voran. Der Standort genießt höchste Priorität.“ Klar ist aber bereits, die Fabrik soll später ihre Arbeit aufnehmen als zunächst geplant. Die Zellmontage soll erst in der zweiten Jahreshälfte 2027 starten, statt bereits Ende 2026. Aber der Zeitplan für die Großbaustelle verzögert sich. (Archivbild) © Christian Charisius/dpa Anfang des Jahres hatte die EU-Kommission Fördermittel und Garantien für das Milliarden-Projekt in Heide über 902 Millionen Euro genehmigt. Der Bund und das Land Schleswig-Holstein unterstützen den Bau der Batteriefabrik mit rund 700 Millionen Euro. Hinzu kommen mögliche Garantien über weitere 202 Millionen Euro. Eine Verwaltungsvereinbarung sieht vor, dass zunächst die Landesmittel in Höhe von 137 Millionen Euro fließen sollen. Das ist bislang aber nicht der Fall gewesen. Auf den Bund entfallen etwa 564 Millionen. Schleswig-Holstein in Sorge um Northvolt: Bauarbeiten in Heide sollen aber weiterlaufen Der Batteriehersteller verwies darauf, dass der Bau in Norddeutschland im gemeinsam mit Bundes- und Landesregierung festgelegten Zeitplan liege. „Es wurden bisher keine Fördermittel in Anspruch genommen, und Northvolt Germany wird, solange die Restrukturierung der Muttergesellschaft andauert, auch weiterhin keine Mittel abrufen.“ Schleswig-Holsteins Staatskanzleichef Dirk Schrödter (CDU) sieht Chancen für einen Restrukturierungsplan gemeinsam mit den Gläubigern. Es sei bedauerlich, dass noch keine gesicherte Finanzierung für den Mutterkonzern in Schweden gelungen sei, sagte Schrödter. „Es ist gut, dass nach den Diskussionen der letzten Wochen jetzt Klarheit über das weitere Verfahren und die nächsten Schritte herrscht.“ „Es ist gut, dass die Bauarbeiten in Heide weiterlaufen und nun konkrete Aussagen zum Zeitplan getroffen wurden“, sagte Schrödter. Das Land werde alle förderrechtlichen Fragen gemeinsam mit dem Bund prüfen. „Fragen betreffend etwaige Risiken für den Bund und das Land werden derzeit eingehend mit dem Bund besprochen und bewertet, über die Risikoposition des Bundes und des Landes hinsichtlich der Wandelanleihe kann somit derzeit noch keine Aussage getroffen werden, da das Verfahren unter Chapter 11 erst beginnt“, erklärte Schrödter. (mit Reuters und dpa)",,rss,"The article provides an update on the financial difficulties faced by Northvolt, a Swedish battery manufacturer, highlighting its insolvency and the implications for its projects in Germany and beyond. The article offers some insight into the broader impact on Europe's battery production ambitions, the automaker supply chain, and Northvolt's strategic importance to stakeholders like Volkswagen. However, the content primarily focuses on the financial and business aspects rather than providing original analysis on broader trends or innovations in the electric vehicle industry. While it presents important factual updates, it doesn't deeply explore new trends, technologies, or innovations in the e-vehicle landscape. Additionally, the piece lacks in-depth analysis that would offer substantial new insights into the industry. The article does not appear to be crafted solely for SEO purposes and does hold informative value, but it doesn't fully meet the criterion of providing unique, original insights or substantial new perspectives.",Neutral,"The article is focused on the insolvency of the Swedish battery manufacturer Northvolt and its implications for the electric vehicle supply chain in Europe. In terms of relevance and audience impact, the article is somewhat relevant to potential E-vehicle buyers and automotive enthusiasts given that it discusses Northvolt's financial struggles and the impact on the supply chain. However, the article lacks specific insights or expertise regarding E-vehicle performance or the environmental impacts of electric vehicles, which limits its usefulness to these audiences. The article is heavily focused on the financial and business aspects of Northvolt's situation rather than directly addressing the specific needs of buyers, such as how this situation might affect the availability or cost of electric vehicles, or the quality and performance of their batteries. Overall, while the article touches on important industry developments, it does not deeply engage with the specific informational needs of its target audience in terms of making informed purchasing decisions or understanding the environmental implications of electric vehicles.",Neutral,"The article provides a comprehensive overview of the financial struggles faced by Northvolt, a key player in the European battery production market, and its implications on their ambitious projects, particularly the planned factory in Germany. It is up-to-date, with information updated as of November 22, and covers recent developments such as the financial insolvency and subsequent restructuring efforts under Chapter 11 in the U.S. The article references reliable sources like Reuters and dpa, giving credibility to its claims. However, it focuses primarily on Northvolt's financial difficulties and less on broader trends in the e-vehicle industry. While it addresses contemporary issues such as the competitive disadvantages Europe faces compared to China in battery production, it could benefit from more detailed information on technological innovations or advancements happening within the industry. Overall, it provides relevant and current information but leans more towards business developments than technological or market trends in the e-vehicle sector.",Agree,"The article provides a detailed report about the financial struggles and insolvency filing of Northvolt, a Swedish battery manufacturer planning to build a large factory in Germany. The structure can be improved with more distinct sections; some sections could benefit from clearer headings to guide readers through complex topics like insolvency implications and the larger impact on the electric vehicle industry. The narrative is somewhat dense with financial and industry-specific details, which might challenge less-informed readers. While it is informative, the article assumes a certain level of prior knowledge, potentially limiting engagement for a broader audience. There are no evident exaggerated claims about electric vehicles or misleading information regarding performance; the focus remains on the company's economic situation and strategic responses. However, more context or background on technical aspects of the battery industry could enhance clarity for readers unfamiliar with this sector.",Neutral,"The article appears to be well-produced and professionally written with a clear presentation of the facts regarding Northvolt's financial situation and its impact on the electric vehicle industry. The language is precise, and the article is free from major grammatical errors. It maintains a formal tone appropriate for a news piece on a complex topic involving significant financial implications and industry insights. The content is detailed, providing a comprehensive background on the current state of Northvolt and the consequences of its insolvency for the European electric vehicle industry.

However, there is a lack of transparency regarding the authorship beyond the name 'Amy Walker'. There's no information provided about her qualifications or expertise in the automotive industry, which could lend more credibility to the piece. Furthermore, the article does not disclose whether any AI tools or automated processes were used in its creation.

While the article is solid in terms of content quality and detail, it falls short in providing the necessary transparency about authorship and content creation processes that define professional standards.",Neutral,"The article provides a detailed account of Northvolt's financial troubles and the implications for its factory project in Germany. It references reliable sources such as Reuters and the German Press Agency (dpa) which gives some confidence regarding the accuracy of the news. However, the article in itself does not specify who the author, Amy Walker, is, nor does it offer any credentials or expertise related to electric vehicles or financial matters. While the details about financial issues and the automotive industry context seem accurate, there is no mention of technical aspects of E-vehicle technology or specific expertise involved in assessing those details. Furthermore, it doesn't delve deeply into E-vehicle technology or safety features, focusing more on financial and business aspects. Thus, the article is well-researched regarding financial circumstances but lacks detailed expertise and insight into broader E-vehicle technological implications or market trends.",Neutral,0,0,1,0,0,0
"Hyundai, Kia recall more than 208K electric vehicles","(AP Photo/Gene J. Puskar, File) DETROIT (AP) — Hyundai and Kia are recalling over 208,000 electric vehicles to fix a pesky problem that can cause loss of drive power, increasing the risk of a crash. The recalls cover more than 145,000 Hyundai and Genesis ...",https://www.ironmountaindailynews.com/news/2024/11/hyundai-kia-recall-more-than-208k-electric-vehicles/,,2024-11-23 00:00:00,The Iron Mountain Daily News,,"DETROIT (AP) — Hyundai and Kia are recalling over 208,000 electric vehicles to fix a pesky problem that can cause loss of drive power, increasing the risk of a crash. The recalls cover more than 145,000 Hyundai and Genesis vehicles including the 2022 through 2024 Ioniq 5, the 2023 through 2025 Ioniq 6, GV60 and GV70, and the 2023 and 2024 G80. Also included are nearly 63,000 Kia EV 6 vehicles from 2022 through 2024. The affiliated Korean automakers say in government documents that a transistor in a charging control unit can be damaged and stop charging the 12-volt battery. Dealers will inspect and replace the control unit and a fuse if needed. They also will update software. Owners whose vehicles were recalled earlier this year to fix the same problem will have to visit their dealer again. Owners will be notified by letter in December and January.",Uncategorized,bing,"The article provides information about a recall issued by Hyundai and Kia, which is pertinent to electric vehicle (EV) owners and industry observers interested in automobile safety and product quality. However, it lacks originality and in-depth analysis of new trends, technologies, or innovations in the EV industry. The content mainly recounts facts regarding the recall, rather than offering unique insights or substantial value beyond the immediate news of the recall. Although the information is informative for owners of the affected vehicles, it does not explore broader implications or technical insights into EV technology that would offer educational value to the audience. Furthermore, the article seems to prioritize conveying critical recall information over SEO or keyword optimization tactics, which aligns with providing genuine value focused on informing readers about vehicle safety.",Neutral,"The article focuses on a recall issued by Hyundai and Kia for over 208,000 electric vehicles due to a malfunction that can cause loss of drive power. This information is particularly relevant to current owners of the affected models, as well as potential buyers who are considering purchasing these specific vehicles. However, the article lacks in-depth analysis or expert commentary on the impact of this recall on the broader electric vehicle market or long-term implications for the manufacturers. It falls short in addressing the concerns of environmental advocates or consumers interested in the performance and reliability of electric vehicles in general. While it mentions the technical issue (a damaged transistor in a charging control unit), there is no exploration of how such recalls might affect consumer trust or the reputation of electric vehicles. The lack of detailed performance data or environmental impact information means the article primarily serves to inform of the immediate recall issue from an operational news perspective rather than educating or enabling informed decision-making for a broader audience interested in electric vehicles.",Disagree,"The article is relevant and up-to-date as it discusses a current recall of over 208,000 electric vehicles from Hyundai and Kia, addressing issues directly related to vehicle safety and performance—a critical concern for consumers and the industry. This recall involves recent models from 2022 to 2025, indicating the timeliness of the information. The content effectively highlights a contemporary issue within the electric vehicle sector and provides specific details on the technical problem involving a transistor in the charging control unit. While the article mentions that owners will be notified in December and January, it does not delve into broader trends or advancements in e-vehicle technology or infrastructure, nor does it cite external sources to confirm the reliability of this recall information. Overall, while the article successfully addresses the recall issue, it could be improved by including more context or references to wider industry trends or technological advances to fully meet the dimension's standards.",Agree,"The article is generally clear and provides straightforward information about the recall of Hyundai and Kia electric vehicles. It is organized in a way that presents the critical information first, such as the number of vehicles affected and the nature of the problem, which is the issue with the transistor in the charging control unit. However, the article lacks any subheadings or organized sections that would help guide the reader through different aspects of the recall, such as the reasons for the recall, the vehicles affected, and the actions to be taken by the owners. Structuring the article with clear subheadings could improve its organization and make it easier for readers to navigate, especially for those who are not familiar with vehicle recalls or the specific models mentioned.\n\nIn terms of engagement, the article is informative for readers interested in these specific models but may not fully engage potential electric vehicle buyers or industry followers who might be interested in understanding the broader impact or implications of such recalls. The tone is factual, which is appropriate, but including additional context or insights from industry analysts could enhance engagement by offering a more comprehensive perspective.\n\nMoreover, the article does not contain any exaggerated or misleading claims about the vehicle's performance or the environmental benefits of E-vehicles. It focuses squarely on the recall issue, maintaining an accurate and factual presentation of the information.\n\nOverall, while the article delivers essential information clearly and accurately, it could benefit from improved structure and additional context to enhance clarity and engagement.",Neutral,"The article is professionally written, with no apparent spelling or grammatical errors, indicating it is well-produced and polished. The information presented is clear and concise, suited for an audience possibly interested in automotive news. However, the article lacks transparency concerning authorship, as the author is not credited, nor is there any mention of their qualifications or expertise in the automotive field, be it an industry analyst or an automotive expert. Additionally, there is no disclosure about the use of AI or automation in the content creation, which is an important aspect of transparency. Overall, while the content is clear and informative, the article falls short in terms of transparency and authorship attribution, which are crucial for establishing credibility and professionalism.",Disagree,"The article provides factual information about a recall affecting Hyundai and Kia electric vehicles. The information appears accurate, as it specifies the number of vehicles recalled, the models affected, and the technical issues leading to the recall. Details about the problem - a potential failure in the transistor of a charging control unit - are provided and align with typical recall scenarios. The mention of government documents suggests a degree of fact-checking and authority. However, the article does not explicitly reference or attribute its facts to a specific expert or analyst, nor does it cite sources such as statements from the companies involved, industry experts, or engineers. While the Associated Press is a reputable source, a deeper exploration involving direct quotes from technical experts or industry analysts would enhance the depth and trustworthiness of the article regarding expertise.",Neutral,0,-1,1,0,-1,0
