title,description,url,image_url,published_date,source,author,content,category,data_source,critique/originality-value-purpose,news_meets_standards/originality-value-purpose,critique/relevance-audiance-impact,news_meets_standards/relevance-audiance-impact,critique/up-to-date,news_meets_standards/up-to-date,critique/clarity-engagement-structure,news_meets_standards/clarity-engagement-structure,critique/quality-professionalism-transparency,news_meets_standards/quality-professionalism-transparency,critique/trust-accuracy-expertise,news_meets_standards/trust-accuracy-expertise,score/originality-value-purpose,score/relevance-audiance-impact,score/up-to-date,score/clarity-engagement-structure,score/quality-professionalism-transparency,score/trust-accuracy-expertise
How Utah's electric vehicle charging prices compare to the rest of the US,"Utah's gas prices are a slightly higher than the national average, but new data shows it has some of the lowest electric vehicle recharging prices.",https://www.ksl.com/article/51195478/how-utahs-electric-vehicle-charging-prices-compare-to-the-rest-of-the-us,,2024-11-22 13:36:00,KSL,,"Estimated read time: 2-3 minutes SALT LAKE CITY — At $3.11 per gallon, Utah's average cost for regular gasoline is one of the more expensive in the U.S. a week before Thanksgiving, about a nickel higher than the national average, according to AAA. However, with an average of about $0.29 per kilowatt-hour, the organization says the Beehive State is home to some of the cheapest electric vehicle prices in the nation right now. AAA announced Thursday that it will now track electric vehicle charging costs as part of its fuel price index in response to a growing demand in the market. ""With nearly 2 million members living in households with one or more electric vehicles, AAA recognizes the need to track the average kilowatt-per-hour cost for all levels of public charging by state,"" officials wrote in a statement. The national average debuted at about $0.35 per kilowatt-hour, making Utah's average roughly a nickel per kilowatt-hour lower than the average. Only Kansas, Missouri, Nebraska, North Dakota and Texas have lower rates in the inaugural report, while Hawaii, West Virginia, Montana, New Hampshire and Arkansas have the highest rates — ranging from $0.42 to $0.57 per kilowatt-hour. The scattered nature is much different from the gasoline prices right now, where the cheapest prices are centered across the lower Midwest and most of the Southeast. The highest gasoline prices are centered across the West and Northeast right now. Additional data shows which states have the most public electric vehicle charging stations. Utah's average is based on a review of the costs at 544 public charging stations scattered across the state, which makes it 21st in terms of available charging stations for anyone to access. There were a little over 37,000 electric vehicles and 76,000 hybrid vehicles registered in Utah this year, according to the Utah Division of Motor Vehicles. The number of electric vehicles alone is nearly seven times higher than what the agency reported five years ago. Meanwhile, the number of public charging stations in U.S. states is fairly close to the country's population leaders, as one would suspect. However, it also indicates which states have jumped onto the electric vehicle trend faster than others. California leads the nation with over 11,300 stations, nearly double any other state. New York, Massachusetts, Florida and Texas round out the top five. Wyoming and North Dakota are the only states with fewer than 20 public stations, at least at the time of the first report. Alaska, Montana and Louisana round out the bottom five in access. Of course, many more are on the way in Utah and across the West. Charge West, a project aiming to add stretches of electric vehicle charging stations across rural highways across Utah, as well as Arizona, Colorado, Idaho, Montana, Nevada, New Mexico and Wyoming, picked up last month. ""(It) will revolutionize electric transportation in the West,"" Tammie Bostick, director of Utah Clean Cities and lead of the Charge West project, said as it launched.",Uncategorized,bing,"The article offers informative data about electric vehicle charging costs in Utah compared to the national average, providing insightful statistics on electricity rates and the distribution of charging stations. However, it primarily serves as a report on the data collected by AAA, lacking substantial original analysis or unique insights into broader industry trends. While it highlights Charge West's project, it doesn't delve into new technological innovations or detailed future implications of these developments, which limits its originality and depth. The piece seems to prioritize informing the reader through factual data over SEO tactics, which is valued, but as a whole lacks depth for those seeking a comprehensive understanding or original takes on the subject of electric vehicles.",Neutral,"The article is relevant to audiences interested in electric vehicles, particularly potential E-vehicle buyers and environmental advocates in Utah. It provides valuable information about the state's electric vehicle charging costs compared to other states, offering insights into potential cost savings for E-vehicle owners. This is crucial for buyers considering the financial implications of charging an electric vehicle versus traditional fuel.

The article does not deeply delve into E-vehicle performance or environmental impacts, which may limit its appeal to environmental advocates or automotive enthusiasts seeking comprehensive technical insights. However, it effectively highlights Utah's positioning in terms of charging infrastructure and costs, which can influence purchasing decisions for consumers within Utah or those considering a move.

Overall, while the article lacks expert analysis on E-vehicle technology or environmental benefits, it effectively addresses the economic aspect of E-vehicle charging in a way that is applicable for potential buyers and local environmental advocates. It could be enhanced by including more detailed analyses such as factors driving low costs in Utah and comparative environmental impacts of driving E-vehicles in the state versus traditional vehicles.",Agree,"The article provides relevant and up-to-date information about the cost comparison of electric vehicle charging in Utah versus other states, which is reflective of recent advancements such as the inclusion of EV charging costs in AAA's fuel price index. It addresses contemporary issues by detailing the current state of public charging infrastructure and offering insights into projects like Charge West, which aims to improve EV charging accessibility. This indicates a focus on technological advancements and infrastructure improvements. However, the article could improve by providing more details about sources or statistics on national trends or impacts of these prices. Additionally, further elaboration on how these developments compare to broader national trends could offer a more comprehensive insight into the industry's direction.",Agree,"The article is generally clear and well-structured, beginning with a headline that defines its focus: the comparison of Utah's electric vehicle charging prices to those in other parts of the US. The introduction provides a quick comparison with gasoline prices which sets the context effectively. The transition from gasoline prices to electric vehicle charging costs is smooth. It introduces AAA's new tracking initiative, giving insight into the pricing landscape across different states which is relevant and informative.

The content progresses logically, moving from Utah's specific pricing statistics to a broader view of national rates and then discussing infrastructure—specifically availability of charging stations in various states. This progression helps the reader follow along and provides a comprehensive picture of the current state of electric vehicle charging costs and infrastructure, particularly beneficial for readers considering electric vehicles.

The article remains objective and avoids exaggerated claims regarding the benefits or drawbacks of electric vehicles. It presents data clearly and objectively, focusing on numerical comparisons rather than sensationalized statements. Additionally, it introduces ""Charge West"" as a future initiative without over-claiming its potential impact.

Overall, the article is concise but informative, engaging readership by providing relevant data and developments in the electric vehicle space that are pertinent to potential buyers or industry followers.",Strongly Agree,"The article generally maintains a professional tone and remains well-produced, with no major spelling or grammatical errors. The content is presented clearly, detailing the comparison of electric vehicle charging costs within Utah to the rest of the United States. However, the article lacks transparency regarding authorship, as it does not disclose the author's identity or qualifications, which are important for assessing the expertise and reliability of the content. Furthermore, there is no mention of whether any AI tools or automation were used in the content creation process. Overall, while the article is informative and structured, the lack of authorship attribution and disclosure on content creation methods detracts from its professionalism and transparency.",Disagree,"The article discusses the pricing of electric vehicle charging in Utah in comparison to the rest of the United States, highlighting that Utah has some of the lowest charging costs. AAA data is cited, adding a level of credibility to the information provided. The article does not contain any noticeable factual errors in terms of electric vehicle technology, charging rates, or market trends. However, there is no information provided on the expertise of the article's author, nor does the article mention any experts or sources who have reviewed or contributed to the content. While the statistics appear accurate, the lack of explicit citations or expertise claims may affect the trustworthiness of the piece according to the evaluation dimension criteria.",Neutral,0,1,1,2,-1,0
